titles,authors,informs,clip_links
모비딕,허먼 멜빌,"세계대표명작을 엄선하여 줄거리, 주제등을  성우의 목소리로 들려주는 세계 명작  보물창고!  오디오북을 통해 세계 대표명작을 만나 보세요.",https://audioclip.naver.com/audiobooks/C8398764AF
"북호텔 (민음사 세계문학, 완독본)",외젠 다비,"외젠 다비의 처녀작 『북호텔』은 1929년 프랑스에서 제정된 ‘포퓰리스트 상’(Le Prix du Roman Populiste)을 받은 첫 번째 소설로서, 그만큼 민중소설로서의 의미와 가치가 크다고 할 수 있는 작품이다. 포퓰리스트 상이란 한 시대의 사회상과 사람들이 살아가는 모습을 현실적으로 묘사한 소설에 수여되는 상이다. 1차 세계대전 이후 대공황의 여파로 프랑스에 닥친 경제 위기와 정치적 사회적 불안 속에 민중들의 삶은 피폐해져만 갔다. 『북호텔』은 바로 이 시기 프랑스 서민들이 살아가는 모습을 한 편의 다큐멘터리처럼 객관적이면서도 생생하게 그려 냈다. 「북호텔」은 1938년 마르셀 카르네 감독이 실제 북호텔과 생마르탱 운하를 배경으로 영화화하여 전 세계적인 주목을 받기도 하였다. 파리, 허름한 호텔, 힘겨운 노동자들의 삶 1928년 파리, 생마르탱 운하가 흐르는 제마프 둑길 옆, 한 허름한 호텔이 서 있다. 파리의 빈민 노동자로서 하루하루를 근근이 살아가던 르쿠브뢰르는 처남에게 돈을 빌려 이 호텔을 헐값에 인수하면서, 드디어 밑바닥 인생에서 벗어날 수 있다는 꿈과 희망에 부푼다. 이 호텔에는 가정부, 대장장이, 인쇄공, 마차꾼, 여공, 지하철 종업원, 수문지기 등 파리의 하층민이라고 할 수 있는 사람들이 살고 있다. 이들 중 어떤 이는 임신한 몸으로 애인에게 버림받고, 어떤 이는 친구에게 여자 친구를 뺏기며, 어떤 이는 추억을 곱씹으며 홀로 노년을 보내기도 한다. 일터로 떠나기 전에 마시는 뜨거운 커피 한 잔, 일터에서 돌아와 들이켜는 독한 술 한 잔을 낙으로 삼는 이들의 삶은 궁색하고 신산하다. 하지만 외젠 다비는 감상적이거나 과장된 태도, 정치적 사견(私見)을 배제한 채 담담한 필체로 서술함으로써 독자들이 보다 객관적인 시선으로 이들의 삶을 바라보고 이들과 함께 기쁨과 슬픔을 나눌 수 있게 해 주었다. 여기에서 우리는 외젠 다비의 서민에 대한 이해와 깊은 애정을 엿볼 수 있다. 바로 그 자신이 가난한 노동자의 아들로서, 빈곤한 삶이란 어떤 것인가를 몸소 체험했기에 가능한 일이었다.",https://audioclip.naver.com/audiobooks/2509CDE020
동물농장,조지 오웰,"《동물농장》은 민주적 사회주의자를 자처한 영국의 소설가 조지 오웰의 작품으로, 스탈린 체제하의 소련 신화와 전체주의를 신랄하게 풍자하고 독재 권력을 날카롭게 비판한 우화 소설이다. 장원 농장의 존스 씨 밑에서 착취당하던 동물들이 인간을 몰아내고 새로운 농장을 건설한다는 내용이다. 이 작품은 당시 영국의 동맹국이었던 소련의 스탈린을 노골적으로 풍자하고 비판했다는 점에서 출간에 난항을 겪었다. 그러나 뛰어난 통찰력과 거침없는 문체로 왜곡된 혁명의 결과와 권력자의 횡포가 국민들의 삶을 어떻게 억압하는지 그려 낸 이 작품은 출간되자마자 베스트셀러가 되면서 오웰은 영국 최고의 작가 반열에 올랐다. 출간된 지 반세기가 훌쩍 넘은 《동물농장》의 감동은 현재 진행형이다.",https://audioclip.naver.com/audiobooks/3B41653590
시간과 장의사,이묵돌,페이스북 페이지/인스타그램 “이묵돌”에서 2018년 10월부터 2019년 10월까지 써 온 단편을 책으로 공개한다. 76편의 단편을 비롯해 이 단편집에서 최초 공개하는 3편의 단편을 수록했다. 다양한 소재의 단편들이 향하는 주된 정서는 바로 ‘상실’이다. 죽음이나 이별과 같은 물리적 사건뿐 아니라 가난이나 계층의 단절 같은 심리적 요소들 역시 상실을 낳게 하는 주된 원인이 됨을 드러낸다. 이런 상실에 관한 글들을 통해 독자는 아이러니하게도 잃어버렸던 감정을 다시 떠올리게 된다. 글을 읽는 동안에는 어렴풋하게만 느껴지던 감정은 글의 말미에 붙어 있는 제목을 접했을 때 좀더 명확해진다. 이렇게 글을 다 읽은 후에 찾아오는 울림은 독자를 생각의 길로 이끈다.,https://audioclip.naver.com/audiobooks/5D69615550
"뻬쩨르부르그 이야기 (민음사 세계문학, 완독본)",니콜라이 고골,"러시아 근대 문학의 선구자 니꼴라이 고골의 단편집 현실과 환상의 결합이 낳은 현실 비판과 따뜻한 휴머니즘 뻬쩨르부르그를 배경으로 도시의 소외된 인간을 환상적으로 그려낸 이야기들 부조리한 세계를 살아가는 인간의 소외된 현실을 조형하는 고골의 단편들은 독특하면서도 지극히 현대적인 상상력과 신랄한 현실 풍자로 그를 러시아 근대 문학의 근원에 자리하게 했다. 『뻬쩨르부르그 이야기』에 담긴 환상성은 현실을 풍자하고 인간의 내재된 욕망을 여실히 드러내는 동시에 웃음과 공포, 인간에 대한 연민을 불러일으키면서 현재를 살아가는 고달픈 현실까지 여과 없이 마주 보게 한다. ▶ 러시아의 작가는 모두 고골의 「외투」에서 나왔다. - 도스토예프스키 ▶ 그 웃음의 배후에서 우리는 보이지 않는 눈물을 느낀다. - 푸슈킨고골의 생생한 풍자 정신과 절묘한 이야기 구성은 역설적이게도 삶의 실제적인 균열을 이루는 불합리성의 승리를 명백하게 보여준다. - 《르 몽드》",https://audioclip.naver.com/audiobooks/19AAB14920
바틀비 (윤도현),김태호,"주인에게 버려진 개 ‘바틀비’는 음식을 먹고 싶지도, 누군가와 마음을 나누고 싶지도 않다. 삶의 의지를 잃은 채 죽기만을 기다리던 바틀비 앞에 어느 날 한 소년이 나타나 따뜻한 손을 내민다. *** 윤도현이 낭독하는 김태호 작가의 「바틀비」는 아이돌 및 각계 저명인사의 목소리 재능을 기부받아 소리책을 만들고 이를 통해 청각 장애인에게 희망의 소리를 선물하는 캠페인에 참여한 작품이다. 캠페인 수익금의 일부는 사랑의 달팽이 재단에 기부되어, 경제적 어려움으로 소리 없는 세상에 살고 있는 난청 아동들에게 희망의 소리를 선물해주기 위한 지원 기금으로 사용되어진다.",https://audioclip.naver.com/audiobooks/4E5B5CEE4D
메밀꽃 필 무렵 (Resound단편),이효석,"「메밀꽃 필 무렵」은 1936년 『조광』 10월호에 발표된 '이효석'의 단편소설로 봉평, 대화 등 강원도 산간마을 장터를 배경으로 장돌뱅이인 허 생원의 삶을 통해 인간 본연의 애정을 아름답게 그린 작품입니다. 허 생원은 얼금뱅이에 왼손잡이라 여자와는 거리가 멀었고 나귀를 평생 벗삼아 살았지만, 젊은 시절 하룻밤의 인연을 잊지 못합니다. 어느 여름날 허 생원은 봉평장에서 장사를 마치고 충줏집에서 술을 마시는데, 젊은 장돌뱅이 동이가 충줏집과 농탕치는 것을 보고는 화가 치밉니다. 그날 달이 뜬 밤, 허 생원과 그의 친구 조 선달, 동이는 대화장으로 이동하기 위해 산길을 걷다가, 허 생원은 동이가 왼손잡이 인 것을 보고 자신과 닮았다고 생각합니다. 「메밀꽃 필 무렵」의 오리지널 스코어를 작곡한 '박석주'는 음악 밴드 ‘주스 프로젝트’의 리더이자 기타리스트입니다. 전통 음악에 바탕을 두고 때로는 고요하게 때로는 화려하게 음을 넘나들며 음악의 본질적 가치를 탐색하는 뮤지션입니다. 국악과 크로스오버, 영화음악 등 무수히 많은 영역에서 활동하고 있는 박석주는 장편독립영화 '이수아'와 연극 '비명자들' 등에서 음악감독으로 활동하기도 했습니다. 100년 전 우리 소설, 아름다운 소리로 만나다. [Resound 단편] 시리즈 소위 ‘고전’이라 불리는 작품들은 시대를 불문하고 인간과 삶을 관통하는 날카로운 통찰을 담고 있습니다. 그러나 한 번쯤 제목은 들어 봤을지라도, 제대로 읽어본 적은 없는 경우가 많습니다. 왜일까요? 어쩌면 고전은 낡고 지루하며 어렵다는 편견이 있는 건 아닐까요. [Resound 단편] 시리즈는 그 편견을 깹니다. 오늘날 활발히 활동 중인 작가들이 고쳐 쓰고, 그 원고를 전문 배우들이 생생하게 낭독하고, 거기에 뮤지션들이 작곡한 음악이 더해져, 고전은 새로운 예술작품이 되었습니다. 옛 것의 가치는 간직하되 새로운 옷을 입고 화려하게 돌아온 50편의 [Resound 단편] 시리즈가 새로운 문학의 세계, 감상하는 오디오북의 세계로 당신을 초대합니다.",https://audioclip.naver.com/audiobooks/D58CBA6D9F
J 하버쿡 젭슨의 진술,아서 코난 도일,"잔잔한 바다 한복판에서 승객 없이 발견된 배 한 척. 배에 있던 사람들은 모두 어디로 사라진 걸까? 코난 도일이 밝혀낸 19세기 최고의 해양 미스터리! 1872년 12월 5일. 북대서양을 거쳐 지브롤터를 향해 가던 데이그라티아호는 망망대해를 느릿하게 떠돌고 있는 배 한 척을 발견한다. 한 달 전 선원 일곱과 선장, 선장의 아내와 딸까지 총 열 명을 태우고 뉴욕에서 출항한 그 배에는 놀랍게도 아무도 타고 있지 않았다. 배 위에서 사라진 열 명의 소식은 그 후로 어디에서도 들려오지 않았다. 과연 그들은 어디로 사라진 걸까? 한 달이라는 짧은 시간 동안, 배 안에서는 무슨 일이 있었던 걸까? 지금까지도 풀리지 않은 이 미스터리를 두고, 당시의 언론과 학자들은 수많은 가설을 제시했다. 배에 실려 있던 공업용 알코올의 증기가 폭발했다는 설, 해저지진을 만났다는 설, 해적에게 습격당했다는 설 등. 그중에서도 가장 큰 신빙성을 얻은 이야기는 1884년 1월 《콘힐 매거진》에 익명의 투고자가 발표한 소설 속 이야기였다. 지어낸 이야기이지만 이 소설은 사실적인 묘사와 기상천외한 발상으로 언론과 문학계에 큰 반향을 불러일으켰다. 일부 언론은 소설의 내용을 진실로 여겨 기사로 내보내기도 하였고, 어떤 문학 평론가는 이 작품을 『보물섬』으로 유명한 로버트 루이스 스티븐슨의 작품이라고 여기기도 했다. 또 다른 이는 에드거 앨런 포에 비교하기도 했다. 작품의 내용만큼이나 출처에 대한 미스터리가 무성했던 이 작품은, 훗날 전설적인 탐정 셜록 홈즈를 탄생시킨 코난 도일의 작품이다. 아직 작가로서 그리 이름을 떨치지 못했던 도일은 학생 시절부터 취미삼아 작품을 잡지에 투고하여 몇 번 원고료를 받은 적이 있지만, 이 작품처럼 큰 반향을 불러일으키며 전문가들로부터 찬사를 받은 적은 처음이었다. (총 4편의 단편의 실린 종이책 <J 하버쿡 젭슨의 진술>중 오디오북은 <J 하버쿡 젭슨의 진술> 1편이 제작되었습니다) 낭독 : 최정호 출판사 : 북스피어 제작 : 블루스토브메이드",https://audioclip.naver.com/audiobooks/B714747020
추운 나라에서 돌아온 스파이,존 르 카레,"20세기 냉전을 다룬 스파이소설이자 영국사회를 적나라하게 고발하는 존 르 카레의 대표작 1960년대 냉전 상황이 극에 달한 시기, 각국 스파이들의 주요 활동 무대였던 베를린을 배경으로 비정한 국제 첩보전의 세계를 그리고 있는 이 소설은, 1964년 영미 최고의 베스트셀러에 오르는 기염을 토했고 또한 뛰어난 문학성으로 평단의 찬사를 받으며 서머싯 몸상, 에드거상 등을 휩쓸었다. 냉전 상황이 극에 달한 1960년대 영국과 독일간 스파이들의 활동과 그와 관련된 이야기를 탄탄한 구성으로 엮었다. 1965년 마틴 리트가 감독하고 리처드 버턴이 주연을 맡은 영화로 제작되어 화제가 된 바 있다. 작가 특유의 긴장감 넘치는 스토리 전개가 여실히 드러나는 작품이다.",https://audioclip.naver.com/audiobooks/C8DAC1E86B
한자와 나오키 3,이케이도 준,"■ 『한자와 나오키 3 : 잃어버린 세대의 역습』 줄거리 도쿄중앙은행의 영업 2부 차장 한자와 나오키는 은행 내 정치싸움에 휘말려, 자회사인 도쿄센트럴증권의 영업기획부장으로 발령받는다. 하지만 증권사는 은행에서 발령받은 은행파와 증권사에서 뽑은 증권파가 사사건건 대립하며 내부적으로 갈등이 있을 뿐만 아니라, 업계에서도 크게 두각을 보이지 못하고 있다. 한편, 도쿄센트럴증권의 조사역 모리야마 마사히로는 일본의 거품 경제가 무너지고 거대한 불경기에 이은 취업 빙하기를 힘겹게 거치며 입사한 잃어버린 세대다. 정작 회사에 들어와보니 자신의 안위만 챙기는 상사들을 보면서 환멸을 느낀다. 그러나 한자와 나오키 부장이 오면서, 모든 것이 바뀌었다! IT 회사 전뇌잡기집단이 스타트업인 도쿄스파이럴을 M&A 하겠다고 도쿄센트럴증권에 의뢰하고, 은행파를 중심으로 팀을 짠다. 하지만 명확하지 않은 이유로 도쿄중앙은행의 증권영업부에게 프로젝트를 빼앗기고, 한자와는 이 일에 배후가 있음을 간파한다. 그리고 인수 대상이었던 도쿄스파이럴이 세계적으로 성장할 수 있는 가능성을 발견하며, 모리야마와 함께 도쿄스파이럴의 편에 서서 은행의 집요한 압박에 맞선다.",https://audioclip.naver.com/audiobooks/37D789D70C
납량특집 : 소오름,유경,오디언 기획 납량특집 소오름,https://audioclip.naver.com/audiobooks/943D008A80
이어폰,윤혜인,"박희상- 희상의 모친은 달맞이봉에 불어 닥친 재개발 붐에 편승해 땅 투기 등으로 큰 재력가가 된다. 장신의 키와 멋진 외모, 최연소라는 타이틀이 들어간 국제변호사 자격증에 전문 경영인 학위, 강남의 내로라하는 집안의 외아들인 희상은 졸부의 표상인 모친의 자랑이다. 희상의 모친은 집안 좋고, 명성 있는 집안의 며느리를 맞이하기 위해 선자리를 마련하지만, 희상은 어렸을 때부터 일편단심인 차이현만을 바라본다. 차이현- 달맞이봉에서도 가장 가난하고 불우한 가정에서 성장한 그녀는, 누구에게도 마음의 문을 열지 않고 말도 하지 않고 오로지 어린 시절 동네 언니가 준 워크맨만을 들으며 살아간다. 그러던 어느 날, 어린 시절 추억의 한 조각으로 남아 있는 희상과 해후하게 되는데……. 항상 이어폰만 꽂고 살아가는 차이현! 그런 이현을 바라보는 박희상! 과연, 희상의 해바라기는 성공을 할 것인가……. 한 남자와 한 여자의 선택. 세상을 버리기 위해 이어폰을 선택했다. 세상을 이용하기 위해 선공을 선택했다. 한밤의 도둑처럼 의미 모를 카세트 테이프만을 남겨주고 떠난 희상을, 이현은 이어폰 속 음악 안에 묻어두었다.",https://audioclip.naver.com/audiobooks/43108EBAB0
애드가 앨런 포우의 추리 공포 그리고 비밀,애드가 앨런 포우,"30센티미터의 송곳이 당신의 귀를 파고든다. 애드가 앨런 포우가 없었다면 우리는 ‘도플갱어’, ‘착신아리’, ‘데스티네이션’을 만나지 못했을것이다. 모든 공포물은 포우에서 시작해서 포우로 끝난다. 고양이의 저주, 고양이의 복수 이야기, 검은 고양이, 목 잘린 모녀의 처절한 비명, 모르그에서 생긴 일. 나의 심장을 살려내라 내 심장을 뛰게 만어라, 배반의 심장. 나와 닮은 사람이 같은 공간에 존재한다. 또 다른 내가 나를 바라본다, 마이 네임 이즈 윌리엄 윌슨. 사랑, 마리의 영혼… 그녀를 죽인 우리 자신의 이야기, 마리의 사생활. 절대 공포의 세계로 당신을 초대합니다.",https://audioclip.naver.com/audiobooks/3BE7DB6AA1
맥베스,윌리엄 셰익스피어,"셰익스피어가 오디오 판타지를 만나다! 셰익스피어의 4대 비극 중 가장 화려하고 잔인한 작품인 ‘맥베스’ ""맥베스, 당신의 흠이 뭔지 아세요? 누구보다도 출세를 원하고 남다른 야심도 있지만 출세에 필요한 ‘잔인함’ 이 없어요!"" - 레이디 맥베스- 야망을 가졌으나 남을 짓밟을 용기는 없는 인물, 맥베스. 그런 남편의 야망을 실현시키기 위해 카리스마를 내뿜는 레이디 맥베스. 레이디 맥베스는 ‘내조의 여왕’ 인가 아니면 ‘파멸의 여신’ 인가? 조금은 어렵게만 느껴졌던 셰익스피어의 작품. 400년이 지난 지금 성우들의 열정적인 연기와 노래, 전율하는 사운드와 함께 오디오 판타지로 부활합니다.",https://audioclip.naver.com/audiobooks/777093B7A3
섬의 애슐리,정세랑,"관광지 댄서에서 나이팅게일로 행복한 신부에서 비극의 희생자로… 애슐리의 눈물이 에메랄드빛 바다가 되다 판타지, SF, 순수문학의 경계를 자유롭게 넘나들며 다양한 독자를 포위하는 정세랑은 <테이크아웃>을 통해 외국의 어느 관광지에서 만난 섬의 애슐리의 이야기를 전한다. 가슴에 조악한 코코넛 껍질을 단 채 관광을 온 본토 사람들 앞에서 전통춤을 추며 생계를 유지하던 단조로운 애슐리의 삶이 소행성의 충돌로 인해 오리엔탈리즘을 대변하고 비극과 희망의 아이콘이 되어 버린다. 그곳에선 어떤 일이 벌어졌고, 섬과 본토의 사람들은 애슐리에게 어떤 일을 한 걸까. 인간의 엉뚱한 욕심에 마구잡이로 희생당하는 애슐리라는 캐릭터는 <바다 어디쯤의 색을 끌어오고 싶었다>는 한예롤의 에너지 넘치는 그림과 함께 강렬하게 마음속에 새겨진다. 정세랑의 단단한 세계와 세상의 비밀을 표현하는 한예롤의 신비로운 컬러가 조화롭게 어우러진다. * 이 오디오북은 한국출판문화산업진흥원(KPIPA) 의 <2020 년 오디오북 제작 지원 사업> 선정작입니다.",https://audioclip.naver.com/audiobooks/C94A12989A
침이 고인다 <침이 고인다>,김애란,"통속을 걷어낸 반짝이는 상상력으로 단숨에 독자를 사로잡는 그녀의 신작 소설집. 다시, 김애란이다! 그렇고 그런 일상에 단물처럼 고이는 이야기들… 슬픔도 담담하게 쓸쓸함도 유머러스하게~ 왜, 김애란인가. 2005년 말, 그녀는 문단과 각종 언론의 관심을 한 몸에 받았다. 대산창작기금 수혜부터 최연소 한국일보문학상 수상 소식, 그리고 첫 소설집 출간. 인터뷰 기사도 꼬리를 물고 이어졌다. 마치 기다렸다는 듯이 문단과 언론은 그녀를 반겼고, 그녀와 관련된 기사들이 여기저기서 봇물 터지듯 쏟아졌다. 하여 그해를 정리하는 기사에서는 “한국 문단이 거둔 최대의 수확 중 하나”로 평가되었을 뿐 아니라, 국민일보에 실린 ‘2005 문화 검색어 톱 10’의 다섯 번째로 선정되기도 하였다. 그 기사의 첫 문장은 “올 문단의 화두는 세대교체였다”로 시작했다. 그녀에 대한 관심은 그 다음 해인 2006년에도 식지 않았고, 2006년에 주목하는 작가로 다시 한 번 그 열기를 이어갔다. 《침이 고인다》에서 작가는 여자들의 방이라는 공간에 대한 풍요로운 소설적 시선을 드러낸다. 학원 강사로 일하며 혼자 살고 있는 그녀에게 어머니에게 버림받은 기억을 가진 후배가 찾아온다. 후배의 엄마는 도서관에서 딸에게 껌 한 통을 쥐여준 뒤 사라진다. 후배는 압도적인 외상적 장면을 그녀에게 말해버린 뒤, 그때 남은 껌 하나를 쪼개서 그녀에게 주고, 둘은 함께 동거하게 된다.",https://audioclip.naver.com/audiobooks/43958769E3
즐거운 나의 집 2,공지영,"공지영 신작 장편소설! 엄마 같은 딸, 딸 같은 엄마. 그들이 펼치는 맥주처럼 알싸한 가족 이야기. 세 번 결혼하고 세 번 이혼한 친엄마와 사는 18세 당찬 소녀 위녕이 들려주는 좌충우돌 엉뚱 발랄 유쾌한 가족 이야기와, 가족이기에 감내해야 했던 상처, 사랑이기에 거부할 수 없었던 고통을 작가 특유의 문체로 치유하고 있다. 이 소설은 시대와 함께 호흡하며 우리의 현재를 이야기하는 작가, 공지영이 발견한 가족, 그 평범함과 특별함에 관한 이야기다. 지금까지 수많은 독자들에게 감동의 눈물을 선사한 작가가 이제는 웃음으로 우리 문학의 새로운 성취를 이루어냈다. 이 소설은 철없는 엄마와 너무 일찍 철든 딸, 그들의 가족 스케치로, 평범하지만 알고 보면 특별한 우리 모두의 이야기를 하고 있다. 소설은 불완전해 보이는 가족 대문에 마음의 지독한 몸살을 앓으며 사춘기를 넘어야 했던 위녕의 목소리로 시작된다. 십대의 마지막을 엄마와 함께 보내면서, 그토록 간절했던 진정한 이해와 사랑을 통해 자신의 소중함을 되찾아가면서 삶의 주체로 당당하게 성장하는 위녕의 이야기를 통해 가족과 사랑이라는 이름으로 새겨진 상처와 고통을 치유하고 있다. 사랑이 있으면 우리는 가족이다. 내 소설과 내 마음이 모두 사랑이기를 바라고 살면 설사 실수투성이 삶일지라도 소중해진다. 그 소중한 마음들이 모이는 곳이 우리 집, ‘즐거운 나의 집’이다. ―저자 인터뷰 중에서 ▶ 줄거리 자세히 들여다보기! 열여덟 살 주인공 위녕은 고 삼이 되기 전 십대의 마지막을 자신이 낳아준 엄마와 함께 보내기 위해 아버지와 새엄마의 집을 떠난다. 여름방학을 이용해 B로 거처를 옮긴 위녕은 새로 자리 잡은 엄마의 집에서 여섯 번의 계절을 보낸다. 그러는 동안 위녕은 새로운 가족(외가 식구들과 형제)을 발견하기도 하고, 사랑하는 존재(고양이 코코)와 동생 둥빈 아빠의 죽음을 맞기도 한다. 또한, 엄마의 새 남자친구를 만나고 또래 친구를 통해 평범한(?) 가족이라는 환상을 깨기도 한다. 무엇보다 위녕 스스로 자신의 상처를 돌아보고 치유하며 엄마의 부재로 인해 혼란스러웠던 자신의 정체성과 함께 가족의 의미를 되찾아간다.",https://audioclip.naver.com/audiobooks/EC5791D6FC
꽃도령 유랑단,임현정,"[본 오디오북은 '요약본'입니다.] 사극의 새로운 무대, 저잣거리에서 한판 걸쭉하게 놀아봅시다! 조선 최고의 구기꾼 은별은 주인나리의 말 한 필 값으로 고작 백 냥에 팔려간 신세가 되고 만다. 팔려간 은별을 맞이한 자들은 조선팔도 제일천하일색으로 소문이 자자한 여섯 꽃도령! 은별을 ‘꽃도령 유랑단’의 일원으로 받아들인 꽃도령들은 화려한 놀이판을 벌이며 ‘주인’을 위한 은밀한 임무를 수행하는데... 조선 최고의 무대, 저잣거리에서 펼쳐지는 달콤 살벌한 놀이극! 조선에 왕이 있기 이전에 백성들이 있었고, 백성들의 삶은 저잣거리에 있었다. 저고리며 치마가 하늘하늘 걸려 있는 포목점, 글자깨나 읽는다는 선비들의 핫플레이스 세책방을 지나, 봇짐장수들이 너도나도 물건을 펼쳐놓은 난전과 북적북적 조용할 새가 없는 주막……. 왕이 잠행에 나설 때나 비춰지던 저잣거리가, 이번에는 이야기의 주무대가 된다. 궐 안만이 불꽃이 튀는 정치투쟁의 장이 아니다. 진짜 투쟁은 바로 여기, 저잣거리 한복판에서 펼쳐진다. 공주를 적대 세력에 빼앗기지 않으려는 폐비와 가문의 권력을 위해 공주의 부마가 되기를 서슴지 않는 왕의 개, 공유. 왕의 개 측은 공주를 폐비 측에 빼앗기지 않기 위해 도리어 가장 사람이 많이 몰리는 곳, 저잣거리에 공주를 숨긴다. 그리고 그 마저도 폐비 세력의 밀정에 노출이 될까 하여, 화려한 놀이판을 벌여 시선을 분산시키는데! 삶이 고스란히 담겨 있는 저잣거리의 생동감 넘치는 모습과 우리민족하면 빼놓을 수 없는 흥과 가락. 민초(民草)에 의해 만들어져 서로가 서로의 고달픈 삶을 위로하며 즐겼던 놀이, 그 끝자락에 있는 마당놀이극을 통해 화려한 볼거리를 선사하며 우리 시대 ‘진정한 위로’의 의미를 묻는다.",https://audioclip.naver.com/audiobooks/B85E3E05C3
