titles,authors,informs
서혜정이 읽어주는 나관중의 삼국지 (상),나관중 저,"동양인의 원초적 사고와 처세의 기본이 담겨있는 삼국지. 후한 말기 조정이외척과 간신들에 의해 좌우되어 민심이 흉흉한 가운데 나라를 구하려는 지사와 호걸들이 방방곡곡에서 떨쳐 일어났다. 그중 천하를 평정하려는 세 호걸이 있었으니 바로 유비, 관우, 장비였다. 이들은 난세의간웅 조조와 강남의 손책과 더불어 천하를 쟁팽하려는 뜻을 품고 간신배의 우두머리 동탁을 타도하기에 이른다. 유비는 조조와 손책, 원술 등의 강대한 세력들의 틈바구니에서 한편으로는 의병을 규합하고 다른 한편으로는 뛰어난 자략가인 제갈량을 끌어들이려고 노력하는데... [전3권]"
비둘기 공주의 비밀,김이환 저,마법에 걸린 공주는 비둘기가 돼서 환생한 자신의 연인을 찾아 도시를 날고 있다. 잃어버린 사랑을 찾아 하늘을 날고 있다는 상상을 해본 적이 있는가? 햇살 가득한 도시의 한켠에서 꽃을 가꾸고 있는 착하게 생긴 남자가 연인이라면… 이 동화속의 상상력이 드라마로 재탄생했다. 국내 최대 문학 사이트인 조아라닷컴 오디오 드라마 공모전 수상작이다. 4B 연필로 예쁘게 그려낸 사랑이야기. 마법과 전생 그리고 밝혀지는 비밀은 원근감을 주고 명암을 나타내고 있다.
악어 (세계환상문학걸작선 제1권),표도르 미하일로비치 도스토옙스키 저,"풍자와 우화, 그리고 판타지가 적당히 섞인 퓨전 소설이다. 전시된 악어를 보러 간 한 사내가 악어에게 잡아먹힌다. 그의 부인과 상인은 악어의 처리를 두고 신경전을 벌인다. 그때 악어의 뱃속에서 사내의 목소리가 들려온다. 그는 살아 돌아 올 수 있을까? 말이 되는 것 같기도 하고 전혀 말이 안 되는 것 같기도 한 이야기가 재치 있게 연결되면서 결국은 당시 러시아 관료주의의 허랑방탕함을 비판하고 인간의 비속한 심성을 적나라하게 드러낸다."
어디에도 속하지 않은 폴의 하루 <라스트 북스토어>,임재희 저,"“모든 문은 잠기고 모든 이는 잠들었으리 깊고 검은 웅덩이는 뒤뜰에 있고 치어들은 어항에서 자라네 깨어 있는 사람은 오직 나 혼자이리” 2013년 첫 장편소설 『당신의 파라다이스 』로 제9회 세계문학상 우수상을 받은 작가 임재희의 소설집. 한국인 이주민들의 신산한 삶을 묘파한 임재희의 세 번째 작품이자 첫 번째 소설집이다. 그동안 임재희는 구한말 조선인들의 하와이 이민을 소재로 한 장편소설 『당신의 파라다이스 』에서 사탕수수 집단농장에서 펼쳐지는 네 남녀의 엇갈린 운명을 그려내 “한국 이민소설 장르의 새 장을 여는 이정표”라는 평가를 받았으며, 두 번째 장편 『비늘 』에서는 소설을 쓰는 삶과 그 시간에 대한 고뇌와 그리움을 통해 글쓰기의 본질을 찾아가는 여정을 보여주었다. 강원 철원에서 군인의 딸로 태어나 21세 때인 1985년에 하와이로 이민을 떠난 그녀는 스스로 “미국인과 한국인의 중간에 선 ‘경계인’”이라고 밝힌 바 있는데 “영어로 의사소통은 하지만 거기에선 아무런 ‘냄새’도 나지 않”으며, “한국어는 정서적으로 교감할 수 있는 유일한 언어”라고 술회하기도 했다. 『어디에도 속하지 않은 폴의 하루 』에서 작가는 전작과 마찬가지로 이민자인 서술자를 내세워 이국적이고 낯선 삶의 풍경을 섬세하게 그려내면서도, ‘미국으로 간 이민자’, ‘한국으로 돌아온 귀환자’, 그리고 ‘한국에서 사는 한국인’이라는 세 부류의 인간형을 통해 ‘경계인’ 또는 ‘주변인’의 개념을, 어느 곳에도 완전히 속하지 못하는 운명에 처한 사람들까지로 확대하고 있다. 그런데 작가는 이 경계인 또는 주변인에 대하여, 단순히 세상으로부터 소외되거나 배제된 자들에 국한하지 않는다. 어느 한곳에 정주하지 못한 채 끊임없이 떠도는 그들을 통해 구획된 장소 너머의 공간에 대해 사유하는 힘을 지닌 존재로 그려냄으로써, “한국도 미국도 아닌 현재 서 있는 곳”이 결국 내가 존재하고 있는 곳이라는 실존적 자각으로 이끌고 있는 것이다."
[단편] 칠면조와 달리는 육체노동자,천명관 저,"천명관은 그 이름 자체로서 힘이 넘치고 독자를 유쾌하게 만드는 작가이다. ‘희대의 이야기꾼’으로서 등단 이후 꾸준히 ‘폭발하는 이야기의 힘’을 선보여온 작가 천명관이 7년 만에 두번째 소설집 『칠면조와 달리는 육체노동자』를 선보인다. 풀리지 않는 인생, 고단한 밑바닥의 삶이 천명관 특유의 재치와 필치로 살아나는 여덟편의 이야기를 읽다보면 여전히 웃음이 나면서도 어느 순간 가슴 한구석이 턱, 막히는 먹먹한 감동을 얻게 되고 그 여운은 진하게 오래 남는다. 그사이 천명관의 유머에는 따뜻한 서정과 서글픈 인생에 대한 뜨거운 위로가 더해졌고, 통쾌한 문학적 ‘한방’은 더욱 강렬해졌다. 「칠면조와 달리는 육체노동자」 한때 잘나가던 트럭운전사였지만 지금은 노가다 일을 하는 중년의 이혼남 ‘경구’는 냉동창고에서 일을 하다 우연히 거대한 냉동 칠면조고기를 받게 된다. 버리고 싶어도 버릴 수 없고 ‘지독하게도 따라오는’ 칠면조를 들고 다니던 경구는 길에서 만난 빚쟁이를 칠면조로 흠씬 두들겨 패주면서 묘한 카타르시스를 느끼는데……"
다락방이 있는 집,안톤 체호프 저,과거의 기억을 떠올리는 어느 화가의 사랑에 대한 기억을 얘기하는 동시에 당시 사회상을 담고 있습니다. 
김만중의 구운몽,김만중 저,"육관대사의 제자 성진은 속세에서 부귀영화를 누릴 수 없는 신세를 한탄하다가, 저승으로 떨어지게 된다. 이후 인간세계에 다시 태어나 ‘양소유’로서 살아가게 되는데……. 한 편의 영화 같은 성진의 삶을 함께 들여다보자."
사씨남정기 2,김만중 저,"“조선 사회의 모순과 실상, 권선징악” 조선 후기 숙종 15년에서 18년사이 쓰여진 고전소설로, 중국을 배경으로 일부다처제의 가정에서 벌어지는 내용을 소설화한 것으로, 숙종이 인현왕후를 폐출하고 장희빈을 중전으로 책봉한 사건에 대하여 숙종이 미혹됨을 깨닫고 모든 것을 원상으로 회복시키기 위한 목적을 담고 있다. 사씨남정기는 정실부인 사씨를 고매한 부덕한 소유자로, 첩 교씨를 간교한 여인으로 설정하였다. 이러한 대립적 인물 설정은 여주인공 사씨의 인격을 강조하기 위한 것으로, 인현 왕후를 옹호하다 귀양을 가게 된 김만중이 인현왕후 폐위의 부당성을 풍자한 것으로 볼 수 있으며, 아울러, 권선징악의 교훈적 의미를 나타내고 있다."
유리로 만든 개,프랭크 바움 저,오즈 시리즈의 작가 프랭크 바움이 쓴 마법 단편!  -마법사가 유리 개 위에서 마법 주문을 외우자 놀랍게도 유리 개는 곧바로 꼬리를 흔들고 알았다는 듯이 왼쪽 눈을 찡긋거리면서 마침내 무시무시하게 짖어댔다.
한 송이 포도 - 일본 중단편 고전문학,아리시마 다케오 저,엄선한 일본 근현대 중단편 문학의 정수! 그림을 좋아하는 나는 친구의 고급 물감에 마음이 끌린다. 그리고 자신도 모르게 친구의 물감에 손을 대고 만다. 아리시마 다케오의 대표작으로 순수한 소년의 마음을 그린 동화.
블랙 피터의 죽음,아서 코난 도일 저,"바다표범 사냥꾼의 의문의 죽음! 오두막에 남겨진 범인의 흔적을 둘러싼 미스터리, 진짜 범인은 누구인가! 추리 걸작선 셜록 홈즈 시리즈 [블랙 피터의 죽음]입니다."
차 한 잔,캐서린 맨스필드 저,"한 여자의 미묘한 질투의 감정을 재치있게 표현하고 있습니다. 길에서 떨고 있던 아가씨를 집으로 데려온 로즈메리, 돌봐 주고 편안하게 해줄 생각이었죠."
박지원의 광문자전,박지원 저,"구걸을 하며 먹고 사는 걸인 광문은 다른 걸인을 죽였다는 오해를 받고, 걸인 소굴에서 쫓겨나게 된다. 쫓겨난 광문은 우연히 약방에서 일하게 되고, 어느 날 약방 주인으로부터 도둑질을 했다는 오해를 받게 되는데……. 박지원의 <광문자전>을 재구성한 작품이다. 심성이 착하기로 유명한 광문의 우여곡절 많은 인생 이야기를 들여다보자."
