titles,authors,informs
타이피,허먼 멜빌 저,"세계대표명작을 엄선하여 줄거리, 주제등을  성우의 목소리로 들려주는 세계 명작  보물창고!  오디오북을 통해 세계 대표명작을 만나 보세요."
주홍 글씨,나다니엘 호손 저,"세계대표명작을 엄선하여 줄거리, 주제등을  성우의 목소리로 들려주는 세계 명작  보물창고!  오디오북을 통해 세계 대표명작을 만나 보세요."
음향과 분노,윌리엄 포크너 저,"세계대표명작을 엄선하여 줄거리, 주제등을  성우의 목소리로 들려주는 세계 명작  보물창고!  오디오북을 통해 세계 대표명작을 만나 보세요."
노생거 사원,제인 오스틴 저,"세계대표명작을 엄선하여 줄거리, 주제등을  성우의 목소리로 들려주는 세계 명작  보물창고!  오디오북을 통해 세계 대표명작을 만나 보세요."
라스트 모히칸,제임스 쿠퍼 저,"세계대표명작을 엄선하여 줄거리, 주제등을  성우의 목소리로 들려주는 세계 명작  보물창고!  오디오북을 통해 세계 대표명작을 만나 보세요."
꽃등연서 8부 - 꽃이 붉다 한들,유춘강 저,"유춘강 작가의 10부작 장편소설 - ‘나의 인생은 더 이상 조선에 없어.’ - 16세기에 조선과 중국 일본을 시 하나로 평정한 최초의 국제적 베스트셀러 작가 허난설헌은 2019년 잠실근처 토성마을에서 8년째 살고 있다. 사자자리에 유성우가 내리던 날 지긋지긋한 조선을 탈출했다. 마치 런던의 버지니아 울프가 코트 주머니 가득 돌을 집에 넣고 템즈강을 향해 걸어갔듯이. 비록 16세기는 스물일곱에 요절한 동양 최고의 여류시인으로 기록됐지만 21세기는 주민센타에서 시를 강의 하고, 대필작가로 살며 자신만의 글을 쓰는 고즈넉한 삶을 산다. 그러던 어느 날 믿을 수 없는 일이 벌어진다. 남편 김성립을 꼭 닮은 남자, 일본의 미남배우 ‘사카구치 켄타로’가 바로 앞집으로 이사 온 것이다. 안개 낀 밤 골목에서 마주친 그는 유령을 본 듯 놀라는 그녀에게 직진하듯 말한다, - ‘나, 김성립 대기만성의 남편이 되겠소.’ - 허난설헌을 죽음으로 이르게 한 원인제공자이며 가장 찌질한 남편의 알려진 김성립. 사실 그는 16세기 기방을 외모 하나로 평정한 꽃선비이며, 조선시대 부적응자인 난설헌을 사랑한 조선판 츤데레 이다. 사대부가의 선비답게 의병장으로 참여한 임진왜란 당시 전투 중 떨어진 유성으로 인해 죽음의 위기에 처했을 때 가슴에 품고 있던 아내의 시, <유선사> 덕에 목숨을 구한 김성립. <유선사>에 반해 그를 구한 왜승 게이테츠 겐쇼는 자살을 선택하려는 그에게 반드시 아내를 만나게 될 것이라는 예언을 한다. 유성의 남자는 시간의 지배를 받지 않는다는 아리송한 말과 함께. 해서 그는 살았다. 1593부터 2019년까지. - ‘그립고 그리우니 바람이 되어서라도 찾겠습니다.’ - 일본에서 500여 년간의 독수공방의 지루한 시간을 기를 쓰고 살아낸 김성립과 16세기는 잊고 서울에서 욜로 족으로 자신만의 생을 사는 난설헌. 드디어 16세기의 그대와 21세기의 당신이 서울에서 만난다. 아내는 무명의 작가, 남편은 타고난 재능을 발휘해 인기배우로. 무덤가를 지키는 꽃등에 새겨진 문신처럼 오래된 그 둘의 사랑은 여전할까? 500년을 이어진 꽃등연서는 과연 전해져서 21세기에는 그들의 사랑이 통할까……."
[12편 오디오드라마] 복층 기숙사의 진실,약빤꽃게 저,"#기숙사괴담 #귀신은있다 #머리카락의주인은누구 실화 기반 이야기 <소쓰있>의 오디오드라마 12편. 반도체 공장에서 일했던 지영님의 사연 제 첫 직장은 기숙사를 제공해주었는데요. 여자 4명이서 방 2개 딸린 복층 아파트를 같이 썼었어요. 2명씩 방을 나누고 복층은 어두침침해서 아무도 쓰지 않았는데요. 저는 다락방 같은 느낌이 너무 좋아서 복층을 박박 청소해서 나만의 아지트처럼 썼어요. 근데 누가 자꾸 복층에 머리카락을 잔뜩 떨어뜨려 놓는 거에요. 내가 열심히 꾸미고 정리해놨는데, 누가 몰래 복층쓰고 치우지도 않으니깐 성질이 나더라고요? 그래서 범인 색출에 나섰는데 저랑 방 같이 쓰는 애도 아니고, 다른 방에 있는 애 한명도 아니라서 남은 애 한명인 줄 알았거든요. 근무시간대가 달라서 나머지 한명이랑 얼굴 볼 기회가 없었는데, 어느 날 만나게 돼서 물어봤더니 걔도 아닌 거에요! 우리 4명 중 아무도 머리카락 주인이 없었습니다! 정말 너무 무서워서 그 길로 회사를 그만두었습니다. 기숙사에서 직접 경험한 공포 실화!"
[5편 오디오드라마] 내가 만났던 쓰레기,잠꼬대 저,"#양다리도아니고세다리 #환장대파티 #김치싸대기재현할뻔 막장 실화를 소개하는 <소쓰있>의 오디오드라마 5편. 잡지 기자인 정윤님의 사연 대학교 때부터 10년간 좋아했던 오빠에 대한 이야기를 하고 싶어요. 신입생 OT 때 오빠에게 반해 따라다니다가, 사귄 지 일주일만에 동생으로밖에 안 느껴진다며 오빠에게 채였어요. 하지만 그 후에도 선후배로 쭉 관계를 이어왔어요. 오빠를 좋아했지만 다른 남자를 안 만난 건 아니에요. 연애할 땐 굉장히 열정적으로 해요. 그래도 오빠가 다시 저와 만나자고 한다면, 저는 누굴 만나고 있든 남친을 버리고 오빠한테 갈 것 같아요. 오빠에게 집착하는 저, 어떡하면 좋을까요? 정윤의 파란만장한 연애사의 끝은?"
[10편 오디오드라마] 그의 허언증,달빛타래 저,"#뜻밖의행운요주의 #촉은존재해 #SNS사기 실화 기반 이야기 <소쓰있>의 오디오드라마 10편. 강원도 군 부대에 근무했던 백현준님의 사연 살면서 한번도 거짓말을 안 해본 사람은 없을 거에요. 근데 군대 동기인 연우는 제가 살면서 단 한번도 만난 적 없는 별종이었어요. 부대 내에서 연우와 민성이는 유독 친하게 지냈는데, 한번은 민성이가 연우의 여친 사진을 보게 되었어요. 여친은 상당한 미인이었고, 연우는 약간 뻐기듯이 민성이에게 여친의 친구는 더 미인인데 소개를 시켜주겠다고 한 거에요. 그런데 민성이가 휴가를 받아 소개팅에 나갔다가 바람을 맞은 겁니다. 알고 보니 모든 게 연우의 거짓말이었고, 연우는 허언증은 처음이 아니었습니다... 현실이 더 막장임을 여실히 보여주는 허언증 동료 실화!"
"영웅의 부활 (윤석열 VS 이재명, 누가 이길까?)",송동윤 저,"영웅의 부활은 지금까지의 작품과들과는 결이 완전히 다른 그의 네 번째 작품이다. ""내 가슴속에는 빼앗길 수 없는 것이 하나 있다. 그것은 바로 희망이라는 것이다"" 영화 <쇼생크탈출>에서 바람조차도 빠져나올 수 없다는 쇼생크 감옥에 갇힌 주인공이 절망 속에서 했던 대사입니다. 대선을 앞두고 나는 다시 희망을 품습니다. 5월 한 달 동안 그 희망의 대상인 윤석열 전총장과 이재명 도지사 두 분의 캐릭터를 <초한지>의 유방과 항우, 한신 <삼국지>의 조조 등 영화에 등장하는 영웅들과 비교해서 이번 대선의 결과를 분석해 봤습니다. 나에게는 흥미로운 작업이었습니다. 그러나 한 번도 뵌 적이 없는 두 분께는 실례가 아닐지 모르겠습니다만, 이번 대선에서 영웅의 부활을 꿈꾸는 많은 사람들에게는 선물이 될 수도 있습니다."
스타일,백영옥 저,"'첫 장면은 경쾌하지만, 마지막 장면에선 가슴이 먹먹해진다.' 1억 원 고료 제4회 세계문학상 수상작, 스타일~! ""체게바라의 혁명 정신도 스타벅스의 카페라떼처럼 테이크 아웃 할 수 있다고 믿는 이 시대에 혁명이란 몸 사이즈가 66에서 44로 줄어들 거나, 키가 160에서 170으로 늘어나는 일 뿐이다 (내용 中)"" 패션지 「A 매거진」 여기자 8년차인 이서정. 화려한 생활을 할 것 같지만 사실 새벽 3시에도 편집장의 ‘일 확인’ 문자가 날아오는 그야 말로 밤낮 없는 노다가 판에서 일하고 있는 그녀다. 어디 그뿐이랴, 7년 전 부모님이 주선해 나간 맞선자리에서 달랑 5분만에 박우진이란 남자에게 차인 이후, 연애 한번 못하고 서른 한살이란 나이를 먹은 그녀가 아니던가. 꾸물꾸물 우울하기만 한 그녀의 삶에도 과연 반짝 햇살이 내리쬐는 날이 과연 올까? 화려한 생활에 묻힌 그녀의 갑갑한 일상이 지금 도발한다."
[단편] 아버지,현기영 저,"제주의 4월, 그곳에는 ‘순이 삼촌’이 있다 현대사에 빛나는 거장 현기영의 문학인생 40년 탄탄한 구성과 서정적인 묘사가 어우러진 중후한 문체로 제주도 수난의 역사를 애정어린 시선으로 파고들면서 특히 ‘4․3사건’의 역사적 진실을 복원하는 데 집중해왔던 현기영의 중단편전집(전3권)이 출간되었다. 동아일보 신춘문예 등단작 「아버지」(1975)부터 계간 『창작과비평』에 발표하면서 문단에 큰 파장을 불러일으킨 ‘4․3소설’의 최고봉이자 ‘4․3사건’ 그 자체라고도 할 수 있는 「순이 삼촌」(1978), 단편소설의 백미인 「마지막 테우리」(1994)까지 모두 30편의 중단편 작품(마당극 「일식풀이」와 희곡 「변방에 우짖는 새」 포함)을 개정해 새로운 장정으로 선보인다. 비록 과작이기는 하나 빼어난 문학적 성취를 보여준 현기영 소설의 정수를 일목요연하게 맛볼 수 있는 이 전집은 작가의 등단 40주년을 기념하는 동시에 그의 작품을 새롭게 조명하는 것이다. 역사에 대한 깊은 성찰과 인간에 대한 애정이 녹아든 명편들은 여전히 변함없는 감동을 자아내며 작가의 강직하고 사려깊은 문학적 삶은 묵직한 울림으로 다가온다. 첫째권 『순이 삼촌』에는 표제작을 비롯하여 10편의 소설이 실려 있다. 이중에서 오랫동안 금기시했던 ‘4ㆍ3사건’을 최초로 세상에 알린 「순이 삼촌」, ‘그날’의 처절한 현장을 역사적 현재의 수법으로 절실하게 재현해낸 「도령마루의 까마귀」, ‘4ㆍ3사건’의 비극을 과거의 역사가 아니라 현재적 사건으로 부각시킨 「해룡이야기」 등 초기 3부작이 돋보인다. ‘폭도’에 가담한 아버지를 둔 소년의 불안한 심리를 묘사한 등단작 「아버지」 역시 ‘4․3사건’과 맞닿아 있다. 특히 대표작 「순이 삼촌」은 학살 현장에서 기적적으로 살아났으나 환청과 신경쇠약에 시달리다가 결국은 자살하고 마는 ‘순이 삼촌’의 삶을 되짚어가는 과정을 통해 30년 동안 철저하게 은폐된 진실을 생생히 파헤친 문제작으로, 한국 현대사와 문학사에서 길이 남을 작품으로 꼽힐 만하다. 이밖에 지식인의 고뇌와 개인의 무력감을 섬세하게 그린 「아내와 개오동」, 소시민의식을 역설적으로 비판한 「동냥꾼」 등은 작가의 사회의식이 잘 드러나 있으며, 개인의 의식세계를 미학적으로 파헤친 「꽃샘바람」 「초혼굿」 「겨울 앞에서」 등에서는 초기 소설의 경향을 엿볼 수 있다. 조선시대 지배계급의 부정부패를 통렬하게 풍자한 「소드방놀이」는 탁월한 상상력과 상징성으로 오늘의 세태를 정곡으로 찌른다."
돌멩이,김혜진 저,"어른들은 자신들의 아이들에게 착한 사람이 되라고 끊임없이 가르친다. 하지만 그러면서도 공부를 제일 잘하는 아이가 되길 바란다. 돌멩이는 학교 폭력에 희생된 한 가족의 이야기다. 그렇다고 신랄한 고발을 위해 쓰인 것은 아니다. 시시한 장난일 뿐인 그들의 주먹질이 누군가의 영혼을 붕괴시키고, 나만 아니면 된다는 차가운 외면이 누군가의 일상을 지옥으로 만들고 있는 오늘의 우리의 모습을 담담하게, 또는 절절하게 그리고 있을 뿐이다. 그래서 더욱 괴롭다. 돌멩이는 내 아이의 이야기이자, 나의 이야기 이다. 바로 우리 모두가 주인공인 것이다."
장마 - 일본 중단편 고전문학,구사카 요코 저,"엄선한 일본 근현대 중단편 문학의 정수! ― 열 번째 이야기 여자 다자이 오사무, 환상의 작가라 불리는, 구사카 요코의 데뷔작. 젊은 나이에 미망인이 된 여성의 고뇌를 생생하게 그린 작품."
인생은 회전목마,오 헨리 저,치안 판사의 사무실에 소달구지를 타고서 산에 사는 부부가 나타납니다. 이혼 판결을 받기 위해서였죠. 오 헨리의 단편 걸작
정은표가 읽는 올더스 헉슬리의 어린 아르키메데스,올더스 헉슬리 저,어린 아르키메데스 (Young Archimedes) “유레카”라는 말로도 유명한 고대 그리스의 수학자 아르키메데스. 이 소설은 그 아르키메데스와 같은 수학 천재에 관한 이야기다. 화자인 영국인은 인간들 사이엔 엄청난 차이가 있으며 천재만이 진정한 인간이라는 천재론을 펼치고 다닌다. 전문적인 음악 이야기나 피타고라스 정리의 증명 과정이 상세히 등장하는 이 작품은 작품 곳곳에서 올더스 헉슬리의 대표작 ≪멋진 신세계≫를 예비하는 요소들이 엿보인다.
겨울이야기(요약),원작 : 윌리엄 셰익스피어 / 요약 : 북코스모스 저,셰익스피어의 [겨울이야기] 요약본 글 : 북코스모스 음원 : (주)와미디어
[단편] 책,성석제 저,"흥겨운 입심과 날렵한 필치, 정교한 구성으로 ‘성석제식 문체’를 일궈가는 중견소설가 성석제씨의 새 소설집은 제2회 이효석문학상 수상작인 「황만근은 이렇게 말했다」를 포함, 2년여 동안 발표한 일곱편의 중&#8226;단편으로 구성되어 있다. 작가는 이번 소설집에서 세상의 공식적인 길에서 한치 비껴난 예외적인 인물들의 생에 주목함으로써 기성의 통념과 가치를 돌아보는 독특한 감동을 선사한다. 작가는 현실에 널린 대상을 포착해 그것을 묘사하는 고전적인 방식이 아니라, 현실의 세목을 하나하나 수집하고 분해한 뒤 거대한 거짓말의 세계로 끌어들여 정교하게 재구성함으로써 기존의 소설문법을 유쾌하게 뒤집어 보이고 있다. 이렇게 해서 탄생한 예외적 인물들, “순수한 개성”의 소유자들로 해서 그의 소설은 “국가&#8226;계급&#8226;계층&#8226;가문 등 전체성적 의미항을 중시하는 우리의 오랜 소설전통과, 나아가서는 한국사회와 근본적으로 맞서 있다”(정호웅)는 평가를 낳게 되는 것이다."
박호산이 읽는 김영현의 깊은 강은 멀리 흐른다,김영현 저,"[100인의 배우, 우리 문학을 읽다] 오디오북 시리즈는, 최민식 문소리 정진영 강부자 등 우리 시대를 대표하는 배우 103명이 한국 근현대문학의 주요 중단편소설 100편을 낭독한 프로젝트입니다. ≪깊은 강은 멀리 흐른다≫는 1984년 ≪창작과비평≫에 발표된 김영현의 등단작이다. 아버지와 어머니를 달리 둔 두 형제가 갈등을 겪고 형제애를 확인하는 과정을 통해 우리 과거사가 남긴 상처를 드러내고 그 치유를 모색한다."
잔향,컬툰스토리 저,"18살 가을, 선선한 바람과 함께 친구인 혜진의 죽음이 선경의 인생을 바꿔놓았다. 혜진의 옛 연인 정민은 혜진의 죽음과 함께 실종됐고, 6년이 지난 후, 선경이 일하는 속옷매장에 어딘가 낯이 익은 남자가 찾아온다. 그 남자의 이름은 민준. 둘은 예고된 듯 사랑에 빠졌지만, 알고 보니 그에게도 숨은 사연이 있었다."
김진태가 읽는 천승세의 포대령,천승세 저,"[100인의 배우, 우리 문학을 읽다] 오디오북 시리즈는, 최민식 문소리 정진영 강부자 등 우리 시대를 대표하는 배우 103명이 한국 근현대문학의 주요 중단편소설 100편을 낭독한 프로젝트입니다. ≪포대령≫은 스스로 “50년대 작가”라고 강조하던 전후작가 천승세의 대표작 중 하나다. 1968년 ≪세대≫ 63호에 발표됐다. 포병부대 연대장 출신 퇴역 장교 ‘김달봉’의 비극적 삶에 주목함으로써 기억 저편으로 내몰린 인간의 절규에 귀를 기울인다. 포대령의 존재는 아직 치유되지 않은 전쟁의 상흔과 광기를 은유한다."
이완의 자세,김유담 저,"2020년 신동엽문학상 수상작가 김유담의 신작 소설. 여탕에서 사람들의 때를 밀어주며 밥벌이를 하는 세신사 엄마와, 여탕에서 자랐지만 무용가로 성공하여 여탕을 탈출할 꿈을 꾸는 딸의 이야기가 유쾌하면서도 따뜻한 필치로 그려진다."
피터팬,제임스 배리 저,"제임스 매튜 배리의 동화 영원히 자라지 않는 소년 피터 팬의 이야기 피터 팬의 작가 제임스 매튜 배리는 스코틀랜드 출신으로, 신문기자이자 영국의 작가이다. 1902년 발표한 자신의 작품 ‘작은 흰 새(The Little White Bird)’의 이야기를 바탕으로, 1904년 5막의 크리스마스 아동극으로 상연한 것이 ‘피터 팬’이다. 이후 ‘켄싱턴 공원의 피터 팬’과 ‘피터와 웬디’라는 소설로도 출간했다. 네버랜드는 영원히 어른이 되지 않는 나라이다. 그곳에는 어렸을 적 부모님을 잃은 아이들이 있고, 피터 팬도 그중 한 명이다. 어느 날 피터 팬은 달링 부부의 집에 들어갔다가 그 집의 개에게 그림자를 빼앗기고, 이를 되찾기 위해 요정 팅커벨과 함께 다시 그곳을 찾는다. 달링 부부의 딸 웬디 덕분에 그림자를 찾게 된 피터 팬은 웬디에게 네버랜드를 소개하며, 그곳에 사는 아이들의 엄마가 될 것을 부탁한다. 그렇게 피터 팬, 팅커벨, 웬디, 그리고 웬디의 두 동생 마이클과 존은 네버랜드로의 여행을 시작하게 된다. 런던의 켄싱턴 공원에는 1912년 피터 팬의 입상이 건립되기도 했으며, 이후 1924년 피터 팬은 하버드 블레 감독에 의해 영화로 만들어지면서 1953년 월트 디즈니의 컬러 애니메이션으로 전 세계 어린이들의 사랑을 받았다."
비밀의 정원 - 세계 미스터리 고전문학,길버트 키스 체스터턴 저,세계 유명 작가들의 미스터리 고전을 엄선하여 소개하는 시리즈의 마흔여섯 번째 작품! 유럽 전역에 이름이 널리 알려진 민완형사 아리스티드 발랑탱 밖으로 통하는 문이 전혀 없는 그의 집 정원에서 끔찍한 살인사건이 일어난다 피해자는 정원으로 어떻게 들어온 것일까? 또 그를 살해한 범인은?
소설 부산,곽재식 외 6인 저,"《소설 부산》은 도시테마소설 시리즈 ‘누벨바그’의 네 번째 앤솔러지로, 세계 여러 도시와 작가들과의 만남을 통해 지역과 문화, 사람이 어우러지는 장을 만들고자 아르띠잔이 기획하였다. KTX 고속철도가 놓이고 부산은 서울에서 두 시간이면 도달할 수 있는 곳이 되었다. 부산은 그렇게 언제든 마음만 먹으면 갈 수 있는 곳이지만, 또 굳이 특별한 일정 없이 가기에는 심적으로 부담스러운 곳이기도 하다. 그래서 특별히 휴가를 즐기거나 부산영화제 등의 행사가 있을 때나 찾게 된다. 알록달록 형형색색의 집들이 빼곡히 산을 채우고 있는 감천문화마을, 해마다 세계 영화인들이 찾는 남포동 거리, 이제는 번쩍이는 초고층 아파트와 호화로운 호텔들로 가득 찬 해운대, 서핑의 메카가 된 송정 등 대한민국 동남단에 위치한 두 번째로 큰 도시인 동시에 휴가지이기도 한 묘한 매력이 있는 곳이 바로 부산이다. 이런 공간에서 추억 한두 개 쯤 쌓지 않은 사람은 없을 것이다. 그래서 우리의 젊은 작가들이 저마다의 추억과 이야기를 들려주기 위해 《소설 부산》을 기획하게 되었다.높은 산이 바다 앞까지 뻗어 있는 형세가 가마솥을 닮았다 하여 붙여진 이름 부산釜山. 이 가마솥에 곽재식 송재현 목혜원 김경희 백이원 임회숙 김이은 작가가 쨍하게 햇빛 쏟아져 내리는 부산에서의 추억과 공간을 다양한 맛과 색깔의 이야기들로 맛깔나게 끓여놓았다. 지난날의 아련한 기쁨과 슬픔을 마주할 준비가 되었다면 칸칸마다 사연을 실은 부산행 기차에 탑승해 진하게 우려낸 이야기를 음미해보길 바란다."
한 포물선이 다른 포물선에게,박정애 저,"1998년 등단해 2001년 한겨레문학상을 받고, 소설부터 동화에 이르기까지 다양한 연령대를 아우르며 자신만의 스토리텔링을 선보인 소설가 박정애의 가족소설. 오늘의 한국 사회를 살아가는 지극히 평범하면서도 리얼한 가족 이야기이다. 40대 중반의 맞벌이 부부, 매사에 느리고 뒤처지는 아들내미와 반대로 야무진 딸내미로 구성된 한 중산층 가족의 치열한 삶을 각자의 자리에서 그려낸 이 책은 부모와 자식의 관계에 존재하는 사랑과 책임, 의무라는 이름으로 서로를 짓누르는 건 아닌지, 본질적으로는 독립된 자아로서의 각자 삶을 서로 이해하지 못하는 건 아닌지 생각해보게 한다. 말이 빠르고 몸도 재바른 11살 딸내미 민지는 욕심이 많은 만큼 다부지게 노력한다. 그래서 키우기도 편하다. 15살 민수는 느린 것은 둘째 치고 정보 해독을 잘 못해 엉뚱한 반응을 보이기도 하고 감도가 떨어진다. 공부도 잘 못하고 친구들한테 무시당하기 일쑤다. 하위권에서 맴도는 성적과 순탄치 않은 교우 관계 때문에 엄청 고민하기도 하지만 집이나 학교에서 큰 말썽을 부리는 법은 없다. 예민하고 우울한 모범생 소녀였던 정란은 한때 시인을 꿈꿨으나 지금은 민수와 민지의 엄마이자 가끔 '멍 때리는 병'이 있는 국어 교사이다. 게으름을 적대시한 아버지 밑에서 억압받으며 자라 늘 성실하고 노력하는 것만이 최선이라 여기는 회사원 영규는 그야말로 전형적인 대한민국 가장이다. 정란네 가족의 갈등과 불안의 근원은 바로 아들 민수인데…. * 이 오디오북은 한국출판문화산업진흥원(KPIPA)의 ‘2020년 오디오북 제작 지원’ 사업 선정작입니다 ."
첫사랑,이반 투르게네프 저,"첫사랑 - 누구도 피할 수 없는 사랑의 행복과 상처에 관한 이야기 톨스토이, 도스토예프스키와 함께 러시아 문학의 3대 거장으로 손꼽히는 투르게네프의 대표작. 등장인물들의 탁월한 심리 및 성격 묘사가 돋보이는 작품. 열여덟살의 주인공 블라디미르는 이웃에 사는 가난한 공작 부인의 딸 스물세 살의 지나이다에게 홀딱 반한다. 지나이다는 개성이 강하고 적극적인 처녀로 자신을 숭배하는 뭇 남성들을 휘어잡아 자신에게 복종하도록 한다. 블라디미르는 그녀 마음에 들고자 온갖 노력을 기울이지만 그녀는 그를 사랑하지 않는다. 어느 날 그는 그녀가 사랑하는 사람이 사실을 알고 큰 충격을 받게 되는데… 사랑은 불가항력적이고 맹목적인 힘으로 사람을 지배하고 사람에게 행복보다는 깊은 상처를 남기지만 그 누구도 독을 지닌 사랑의 행복과 그 상처를 피할 수가 없다, 사랑은 우연하고도 찰나적이며 인간의 정신적 육체적 성숙 과정에 영원한 영향을 준다는 그의 철학은 작품의 밑바탕을 이룬다. 더불어 모든 면에서 주변 사람들을 압도하고 뭇 남성들을 지배하면서도 한 남자에게 지배당하는 여인, 정열적이고 모순적인 지나이다의 형상이 여성 심리 묘사의 달인 투르게네프의 섬세한 펜 끝에서 생생한 빛을 발하고 있다. 사랑을 위해 4미터 담장 위에서 뛰어내리는 블라디미르의 무모함, 남자다움을 보여주기 위한 어처구니없는 행동, 나이프를 들고 깜깜한 정원에서 연적을 기다리는 블라디미르의 심리 역시 더할 나위 없이 섬세하게 그려진다. ""내 아들아, 여인의 사랑을 두려워해라. 그 행복, 그 독을 두려워해라."""
