titles,authors,informs
양준모가 읽는 조해일의 뿔,조해일 저,"[100인의 배우, 우리 문학을 읽다] 오디오북 시리즈는, 최민식 문소리 정진영 강부자 등 우리 시대를 대표하는 배우 103명이 한국 근현대문학의 주요 중단편소설 100편을 낭독한 프로젝트입니다. ≪뿔≫은 1972년 ≪문학과지성≫에 발표된 조해일의 단편이다. 문학청년 주인공과 그의 하숙집 이사를 돕는 지게꾼이 동행하면서 겪는 이야기를 통해 속도경쟁에 몰두하는 산업사회의 ‘효용성’을 풍자한다."
언제나 당신인 이유,조진경 저,"강아지는 귀엽지만 아이는 싫다. 남들이 보기엔 강아지 옷을 만들며 밝게 사는 영인. 동그란 눈의 강아지는 귀여워서 어쩔 줄을 몰라 하지만, 아이는 딱 질색으로 싫어한다. 친한 언니이자 사업을 도와주는 주미와 오피스텔로 이사한 그녀는 젊지만 까칠한 관리소장인 준하와 만나게 되는데…. “강아지 짖는 소리 때문에 민원이 계속 들어오는 건 알죠?” “주의하도록 할게요. 그럼 이만.” 살짝 고개를 숙였다가 들고 그의 옆을 지나갔다. 나를 볼 때마다 인상을 쓰고 말하는 그를 보면 종일 재수가 없었다. 오늘도 고객의 컴플레인에 시달리게 되는 건 아닌지 모르겠다. “아줌마, 강아지 키워요?” 엘리베이터를 타려는데 뒤에서 아이의 목소리가 들렸다. 돌아보니 어제도 내게 달라붙어서 귀찮게 하던 아이였다. 대체 엄마가 누구인지, 매번 아이만 혼자 다녔다. “아니, 엄마는 어디 있니?” “나, 엄마 없어요. 아줌마가 우리 엄마 할래요?” 뭐? 엄마? 다섯 살도 안 되어 보는 아이에게 화를 낼 필요는 없다. “그럼 아빠는 어디 계셔?” “우리 아빠요?” 아이가 손을 올려 가리키는 곳을 보자마자 눈살을 찌푸렸다. 아… 이 오피스텔의 관리소장이 아이의 아빠라니……."
자전거에 탄 쓸쓸한 사람 - 세계 미스터리 고전문학,아서 코난 도일 저,"세계 유명 작가들의 미스터리 고전을 엄선하여 소개하는 시리즈의 스물한 번째 작품! 남아프리카에서 알게 된 노인의 조카딸을 찾는 두 사내. 그녀의 형편이 어렵다는 사실을 알고 그들 중 한 사람이 자기 집의 가정교사로 그녀를 고용한다. 그의 집에서 런던으로 나올 때면 자전거를 타고 그녀의 뒤를 따라오는 의문의 사내. 《출판사서평》 추리의 세계는 언제나 흥미진진하다. 공상의 세계 역시 흥미진진하기는 하지만 그것은 현실과 상관없이 펼쳐지기도 한다. 고립된 독방에서도 너른 세상의 수많은 사람들과 다채로운 일들을 떠올리게 해주는 것이 공상이다. 물론 이것도 개인의 경험을 바탕으로 펼쳐지기는 하지만 거기에 논리성 같은 것은 필요 없어서 이 사건이 저 사건과 하나가 되기도 하고 한 사건이 전혀 연관성 없는 다른 세계로 펼쳐지기도 한다. 하지만 추리는 언제나 현실에 기반을 두고 있다. 하나의 사건 속에서 벌어진 일들은 서로가 밀접한 관계를 맺고 있으나 주의해서 잘 관찰하지 않으면 아무런 관계가 없이 벌어진 일처럼 보이기도 한다. 그렇기 때문에 추리에서는 세심한 관찰과 풍부한 지식이 무엇보다 중요한데, 관찰에서 놓치는 부분이 있으면 결론에 이르기까지의 연결고리가 끊어져 결론에 이르지 못하거나 억측을 낳아 전혀 엉뚱한 곳에 다다르게 되고, 풍부한 지식이 없으면 관찰을 통해 밝혀낸 사실들의 참된 의미를 알지 못해 결정적인 사항을 놓치거나 역시 엉뚱한 결론에 다다르게 되기 때문이다. 따라서 추리에는 관찰과 지식, 그리고 논리성이 절대적이다. 이번 시리즈에서는 세계적 명성을 얻은 작가들의 추리소설을 소개하겠다. 그들이 펼쳐 보이는 화려한 추리의 세계를 통해 재미와 함께, 정확한 추리를 위해서는 무엇을 관찰해야 하는지 또 관찰을 통해 얻은 사실은 무엇을 의미하는지 그러한 사실들을 어떻게 논리적으로 연결 지어야 하는지, 그 과정을 배워보기 바란다."
아들이 된 아빠,토마스 앤스티 저,"영혼 체인지 작품의 원조 격 아빠와 아들이 영혼이 뒤바뀌며 전하는 대리만족의 재미와 역지사지의 가치 딕은 겨울 방학이 끝나서 학교로 돌아가야 하는 게 무척 싫다. 하지만 아빠는 다시 아이가 되어 학교에 다니고 싶다며 딕의 마음을 전혀 몰라준다. 때마침 딕의 외삼촌이 준 마법의 돌로 인해 아빠는 아들의 모습으로, 아들은 아빠의 모습으로 뒤바뀐다. 서로의 역할을 맡게 된 아빠와 아들에게 앞으로 어떤 일이 벌어질까? 《아들이 된 아빠》는 영국에서 태어난 소설가 토머스 앤스티가 1882년에 맨 처음으로 발표한 작품이자, 그에게 대중적인 인지도를 높여 준 작품이기도 하다. 이 작품의 주요 설정은 바로 ‘영혼 체인지’다. 영혼 체인지는 이제 영화나 드라마에서 어렵지 않게 찾아볼 수 있는 단골 소재다. 하지만 엄밀히 말하면, 영혼 체인지는 이 작품이 먼저라고 할 수 있다. 개구쟁이 아들 딕은 겨울 방학이 끝난 뒤 학교로 돌아가기 싫어하지만 권위적인 아빠는 무조건 학교에 가라고 할 뿐, 아들이 어떠한 어려움을 겪고 있는지 이해하려 하지 않는다. 그러다 아빠와 아들이 마법의 돌로 영혼이 뒤바뀌면서 서로의 역할을 바꿔야 하는 황당한 상황에 처한다. 어쩔 수 없이 학교에 간 아빠는 아들의 친구들에게 맞기도 하고, 학생들을 억압하는 학교생활도 경험하게 된다. 반대로, 아빠의 역할을 하게 된 딕은 집에서는 전쟁 놀이와 산적 놀이를 하고, 회사에서는 사업 파트너에게 쓰레기 벼락을 내리는 장난을 치며 아빠의 사업을 엉망으로 만들기도 한다. 하지만, 그 모든 과정은 입장 바꿔 서로를 이해하는 데 큰 도움을 준다. 독자는 두 사람의 영혼 체인지를 통해서 대리 만족의 희열도 느끼고, 아빠와 아들의 시선을 동시에 경험하며 고충을 이해할 수 있다."
장기 입원 환자,아서 코난도일 저,홈즈 시리즈 두 번째 단편집 ‘셜록 홈즈의 회상’에 수록된 [장기 입원 환자]입니다. 가난한 의사가 투자자를 만나 병원을 개업합니다. 그리고 투자자는 병을 치료하기 위해 2층에 공간을 마련하고 장기 입원 환자가 됩니다.
김동인의 감자,김동인 저,"사농공상의 2위인 농민의 자재이지만 어려서부터 도덕을 중요시 여기는 마음을 간직했던 복녀. 팔십원에 팔려 결혼을 하고 빈민굴에 들어서면서 그녀의 인생이 뒤틀리기 시작하는데……. 김동인의 감자를 보기 쉽게, 현대적 해석에 맞춰 재구성한 작품이다. ‘도덕’이라는 기치를 지켜왔던 복녀가 현실에 타락해 가는 모습을 적나라하게 보여주고 있다."
상어 섬의 어머니들,킷 리드 저,"“유리감옥을 깨뜨려라!” SF 소설의 페미니즘 르네상스를 이끌어온 전 세계 여성 작가들의 주옥 같은 작품을 가려 모았다. 오늘날 SF 소설계에서 가장 인정받는 편집팀으로서 여러 상을 수상하기도 한 앤 밴더미어와 제프 밴더미어 부부가 선정하고 구성한 뛰어난 페미니즘 SF 선집이다. 1960년대 작품부터 동시대 작품까지 두루 포함하는 이 선집은 페미니즘 담론의 확장을 추구하는 동시에 상상력 넘치는 풍성한 생각거리로 독자들을 이끈다. 이 걸작선은 SF와 페미니즘의 연관관계를 보여 주는 대담한 사례들을 모았다. 조안나 러스의 고전 <그들이 돌아온다 해도>에서부터 에일린 건의 <중간관리자를 위한 안정화 전략> 같은 풍자적인 작품까지, 이 영역의 작업들이 가지는 강렬한 집중도를 드러낸다. 캐서린 M. 밸런트와 같은 주목받는 작가들과 함께 반다나 싱, 히로미 고토와 같은 전 세계 작가들의 작품을 포함한 이 선집은 페미니즘의 다양한 목소리들을 담아낸다. 이 선집은 동시대 소설과 페미니즘의 두 측면에서 새로운 전선들로 사고를 확장한다. 환상적인 작품에서 미래지향적 작품으로, 신비로운 작품에서 초현실적인 작품으로 옮겨가는 이야기들은 지금 우리가 접할 수 있는 어떤 책과도 다른 페미니즘을 향한 생각들과 감정들을 불러일으킨다. “SF 소설이 가진 남다른 정치적 힘을 보여주는 꼭 필요한, 잘 가려 뽑은 선집.” - <커커스 리뷰> “여기 수록된 이야기들은 우리가 원했던 바로 그 일을 해낸다. 진부한 설정들을 찢어발기고, 젠더와 그 함의에 의문을 던지고, 풍자와 유머와 사회적 징후와 규정들에 대한 날카로운 지적 분석을 동반한 의도적 무지를 이용하여 정체성을 들여다본다.” - 마베쉬 무라드, <토르닷컴> “지난 수십 년간 여성 SF 작가들이 이룬 가장 빛나는 성과들을 엮은 다채롭고 놀라운 선집이다.” - 앤드류 앤드류스, ‘truereviewonline.com’ “저자들은 모두 페미니스트이며 SF 소설 혁명의 자매들이다. 그러므로 그들의 역할은 가능한 세계와 존재의 방식들을 탐험하는 것이며, 그려진 시나리오들로부터 각자의 교훈을 끌어내는 것은 독자들의 몫이다.” - 에리카 스미스, <피스 뉴스> “페미니스트든 아니든 SF 소설 팬이라면 누구나 반드시 읽어야 할 필독서이며, 이런저런 여성학 관련 학습과정을 짤 때 활용할 수 있는 흥미로운 텍스트가 될 것이다.” - 다이앤 칸스, ‘worldliteraturetoday.org’ “이 매혹적인 선집은 뉴웨이브 SF와 페미니즘 사변소설계의 경향들이 어떻게 여성과 페미니즘에 관한 문화와 관점의 변화들을 반영하고 있는지 보여준다.” - 바네사 부시, <북리스트> “이 책에 실린 작품들은 모두 여성들이 세계와 맺고 있는 관계의 양상들을 탐구한다. 이 작품들은 사회적 역할과 성역할, 성별, 연애 관계, 일과의 관계에 주목한다.” - 일레인 갤러퍼, <인터존> “이 책은 우리 모두가 연루돼 있는 장르와 젠더, 문화와 맥락에 관한 논의에서 빠질 수 없는 강력하고도 귀중한 선집이다.” - 캐리 스페링, <스트레인지호라이즌닷컴> “밴더미어 부부가 페미니즘 면에서든 다른 어떤 면에서든 근래 들어 최고의 SF 선집이라 할 만한 걸 엮어냈다.” - 일리저베스 핸드, <로스앤젤레스 타임즈> “주제에 맞게 배열된 작품들은 각각의 작품을 가장 선명하게 조명해내는 도발적이고 극적인 배치를 통해 서로 흘러들고 또 서로 반발한다.” - 《퍼블리셔스 위클리》 “편집자들은 이 선집을 얻기 위해 넓게 멀리까지 작품들을 뒤졌다. 다양한 SF의 향연. 장르와 정치적 성향을 떠나 이 책은 훌륭한 선집이다.” - 키스 브룩, 《가디언》 “이 ‘고도로 잘 정돈된’ 페미니즘 SF 선집에는 분명하게 밴더미어 부부의 도장이 찍혀 있다. 이 선집은 호러와 판타지를 포함한 사변소설의 모든 장르를 아우를 뿐만 아니라 이런 주제의 선집에 대한 모두의 기대를 뛰어넘으며 상당한 분량의 초현실적이고 기괴한 작품들까지 선보인다.” - 귀네스 존스, 《뉴욕 SF 리뷰》"
무희 - 일본 중단편 고전문학,모리 오가이 저,"엄선한 일본 근현대 중단편 문학의 정수! ― 두 번째 이야기 나쓰메 소세키와 어깨를 나란히 했던 일본의 문호 모리 오가이 서양 여성과 동양 남성의 사랑을 그려 커다란 충격을 주었던 작품 일본 낭만주의, 유미주의에 지대한 영향을 주었던 작가의 대표작"
김은석이 읽는 미하일 불가코프의 모르핀,미하일 불가코프 저,"모르핀(Морфий) 1917년 러시아 혁명을 전후해 고독 속에서 모르핀에 중독돼 스스로 삶을 망가뜨렸던 한 젊은 의사의 이야기이다. 작가 자신의 실제 중독 경험을 바탕으로 했다. 군청 소재지 병원의 의사 봄가르드는 의대 동창인 인근 시골병원 의사로부터 급히 와달라는 편지를 받는다. 하지만 다음날 그가 출발하기도 전에 동창은 자살 시도를 한 상태로 병원에 실려 오고, 자신의 노트를 남긴 채 결국 사망한다."
김정이 읽는 테오필 고티에의 옹팔,테오필 고티에 저,"옹팔 (Omphale) 학교를 졸업하고 진로를 고민하던 주인공은 파리에 있는 삼촌 집에 잠시 머무른다 소년은 별채 벽에 걸려 있는 태피스트리 속 리디아의 여왕, 옹팔에게 묘하게 매료된다. 그런데 어느 날 밤, 옹팔이 태피스트리에서 걸어 나와 침대 옆으로 다가와 소년에게 말을 건다."
의자 고치는 여인,기 드 모파상 저,후작의 저택에 모인 사람들은 사랑을 주제로 얘기를 나누게 되고 그 자리에서 마을 의사는 의자 고치는 여인의 일생과 사랑 얘기를 들려줍니다. 기 드 모파상의 단편
명작 다이제스트-레 미제라블,빅토르 위고 저,"세계 대표작품의 작품 줄거리, 해설"
그 여자의 동거기,최연숙 저,"아침에 일어나 보니 내 옆에 낯선 남자가 있었다. 선우 : (놀라 소리치는)꺄아아악, 도둑이야! 악!! 정우 : (잠결에)뭐야, 당신 누구야!! 선우 : 뭐? 야! 너 뭐야? 너 누군데 내 옆에서~~아아아악 나 몰라 미친 놈? 아니 개뼉다귀 같은 이 변태새끼야? 뭐냐고~~ 서로 전혀 모르는 두 사람은 어느 날 아침 같은 방, 한 침대에서 일어난다. 5년 만에 한국에 귀국해 자신의 아파트에 들어온 정우와 정우의 동생을 통해 아파트에 전세로 들어와 살고 있는 선우. 결국 그들의 원치 않은 동거는 시작된다. 까칠한 남자 서정우! 만만치 않은 여자 유선우! 지난 사랑에 상처받은 이들! 이 둘은 어떻게 사랑에 빠지게 될까? 마이클럽에 연재되어 많은 사랑을 받았던 그 여자의 동거기!"
이호재가 읽는 베르톨트 브레히트의 이단자의 외투,베르톨트 브레히트 저,"이단자의 외투(Der Mantel des Ketzers) 소설의 주인공은 중세 가톨릭교회에 맞서 자신의 철학적 과학적 신념을 지키다가 화형당한 실존 인물, 지오다노 부르노이다. 소설 속 브루노는 이단으로 몰려 종교재판소에 체포되기 직전 외투를 한 벌 맞췄는데 값을 치루지 못했다. 재단사는 외투 값을 포기하지만 고집 센 그의 아내는 위협을 무릅쓰고 직접 교황청을 찾아간다. 작품을 발표한 1939년은 독일에서 나치즘이 창궐하던 시기였다. 브레히트는 사회적 공정함이 사라지고 사상과 학문의 자유를 억압하는 시대를 비판하고자 했다."
전현아가 읽는 하라 다미키의 여름 꽃,하라 다미키 저,"여름 꽃(夏の花) 일본 원폭문학의 대표작으로 손꼽히는 소설이다. 작가 자신이 직접 겪은 피폭 체험을 바탕으로 히로시마에 원폭이 떨어지던 그날의 이야기를 생생하게 들려준다. 원제는 ‘원자폭탄’이었는데, 1947년 발표 당시 연합국사령부의 검열을 의식해 제목을 바꿨다. 처절한 내용을 담고 있지만 문학성이 높은 아름다운 문장을 구가하고 있는 점이 높이 평가받는 작품이다."
단식 광대 (세계환상문학걸작선 제1권),프란츠 카프카 저,"1922년 문예지 ≪디 노이에 룬트샤우(Die Neue Rundschau)≫를 통해 발표됐다. 작가는 자신에게 가장 친근한 주제, 곧 죽음, 예술, 고립, 금욕주의, 영혼의 빈곤, 쓸모없음, 개인의 실패 그리고 인간관계의 타락에 대해 이야기한다. 주인공은 서커스에서 단식으로 인기를 끄는 광대이다. 하지만 인기는 점점 시들어지고 그는 사람들의 무관심 속에 방치된다. 광대는 마지막 단식을 감행한다. 그는 단식을 성공하고 무사히 우리를 빠져나올 수 있을까?"
셰익스피어 이야기,찰스 램 저,"19세기의 뛰어난 수필가이자 문학평론가인 찰스 램이 누이 메리 램과 함께 셰익스피어의 희곡들을 어린 독자들을 위해 산문으로 다시 쓴 책이다. 4대 비극 <햄릿>(Hamlet), <맥베스>(Macbeth), <오셀로>(Othello), <리어 왕>(King Lear)과 함께 여러 이야기를 담았다. 저자 서문에 나와 있듯이 찰스 램이 쓴 비극은 비교적 원전에 충실하려고 노력했고, 메리 램이 쓴 희극은 비교적 자유롭게 각색했다. 셰익스피어의 언어를 살릴 수 있는 곳에서는 최대한 그의 글맛을 살리려 노력했다고도 밝히고 있다. 이 책에는 셰익스피어의 희곡들을 어린 독자들에게 쉬우면서도 원작의 문학적 향기를 그대로 전달하려는 노력이 담겨 있다."
"개미, 내 가여운 개미 : 또 밤이 오면",류소영 저,"<개미, 내 가여운 개미>는 작가 류소영의 두 번째 소설집이다. 두 번째 소설집은 여전히 부적응자의 연장선상에 놓여 있다. 오랜 시간이 말해주듯 작가의 시선과 문장은 더욱 내밀해지고 단단해졌다. 부적응자의 연대는 관계에서 소외받은 희미한 사람들의 서글픈 연대 의식으로 첨예화되었고, 유령 같은 존재들을 호출하는 방식은 그로테스크하고 날카롭게 그려져 있다. 등장하는 모든 인물들은 있는 듯 없는 듯 희미한 유령 같은 존재들이다. 이번에 소개되는 <또 밤이 오면>은 시부모님을 모시고 사는 한 며느리의 이야기이다. 어느 날 시어머니가 말도 없이 가출을 감행하고, 그런 시어머니의 행동에 가족들은, 특히 나(며느리)는 혹시나 하는 마음에 마음을 졸인다. 시어머니는 나 때문에 집을 나가신 것일까?"
홍길동전,허균 저,"“우리나라 최초의 국문 소설” 조선 세종 때 판서의 서자로 태어난 홍길동이 자신에 대한 가족들의 살해 기도를 피해 의적 생활을 하자 나라에서 그의 체포에 나선다. 홍길동이 다양한 도술로 이를 모면하자, 나라에서는 그에게 병조판서 벼슬을 내리고 홍길동은 이를 받아들인다. 홍길동은 후에 조선을 떠나 자연이 아름다운 율도국을 발견하고 그 곳의 왕이 되어 잘 다스렸다는 내용이다. 적서차별을 비롯한 사회적 불평등에 대한 비판적인 문제의식이 돋보이는 작품으로 둔갑술을 비롯한 주인공 홍길동의 다양한 도술이 독자의 흥미를 더한다."
형사 K의 미필적 고의,이춘길 저,이 오디오북은 한국출판문화산업진흥원(KPIPA)의 ‘2021년 오디오북 제작 지원 사업' 선정작입니다. 소설집 『형사 K의 미필적 고의』에는 그동안 여러 지면에 발표한 단편 일곱 작품이 수록돼 있다. 선이 굵으면서도 감정의 결을 섬세하게 유기적으로 직조한 단편소설들은 입체파 미술처럼 강렬하다.
남명렬이 읽는 최인준의 암류,최인준 저,"[100인의 배우, 우리 문학을 읽다] 오디오북 시리즈는, 최민식 문소리 정진영 강부자 등 우리 시대를 대표하는 배우 103명이 한국 근현대문학의 주요 중단편소설 100편을 낭독한 프로젝트입니다. ≪암류≫는 동반자작가 최인준이 1934년 9월부터 12월까지 ≪신동아≫에 연재한 중편소설이다. 아들을 서울로 보내 공부시키려다가 가산을 탕진하고 파멸을 맞는 농촌 가정의 이야기를 통해 절망적인 농촌 현실을 보여준다. ‘암류(暗流)’는 ‘겉으로 드러나지 않는 저변의 흐름’을 뜻하는데, 이 작품에서는 ‘가난’이라는 벗어날 수 없는 운명을 가리킨다."
호텔마마 6 : 그리고 예외는 없다,양수련 저,"영화처럼 숨막히는 추리 스릴러다. 사회에서 루저로 살아가는 나를 받아주는 곳은 호텔마마, 바로 엄마뿐이다. 항상 정성스럽게 아들인 나를 챙겨주는 엄마. 그 행복을 당연하게 여겼다. 끝나지 않을 줄 알았다. 하지만 존재조차 몰랐던 아버지 다른 형이 등장했다. 형은 엄마와 나의 집, 호텔마마에 들어와 제 자리인양 활개를 치고 다닌다. 순식간에 엄마의 마음을 앗아가고 급기야는 당연히 내 것이 되어야 할 공간 ? 호텔마마까지 넘보려 한다. 빼앗길 수 없다. 호텔마마는 나만의 것이다! 현대에 살아가고 있는 우리들이 모델인듯 현실성이 넘치면서도 우리들이 한번씩 꿈꾸었던 욕망을 소유하기 위해 움직이는 작품 속 주인공들을 지켜보다 보면, 어느새 소설의 마지막 페이지에 바쁘게 다다른 당신을 발견할 수 있을 것이다. 《책 속으로》 이틀 후면 드디어 출소다. 도시를 누빌 수 있는 자유의 몸이 된다. 기쁘다는 생각은 바람 한 점 만큼도 들지 않는다. 어둑하고 습한 감방에 갇혀 있던 지난 12년. 내게는 그야말로 미궁이었다. 12년 만에 보게 될 바깥세상은 또 얼마나 달라져 있을까. 두렵기도 하다. 억울한 내 옥살이만큼이나. 내게 왜 이런 일이 생긴 것일까. 생각을 곱씹고 또 곱씹었다. 무려 12년 동안이나. - 호텔마마 1 - 그는 왜 나를 궁지로 몰았을까 中 형은 경찰에 시달리다가 귀가한 나를 맞아주었다. 현관 앞에 서있는 형을 본 체 만 체하고 나는 주방 앞에 섰다. 음식 냄새가 진동했으나 엄마는없었다. 식탁엔 엄마의 음식이 한 상 가득 차려져 있었다. “흉내를 좀 내봤는데 맛은 장담을 못하겠네. 한 집에 살면서 지난 육 개월 동안 너와 내가 밥 한 끼를 제대로 같이한 적이 없더라.” 경찰 심문은 사람의 진을 빼놓는 일이었다. 나는 몹시 허기져 있었다. 허겁지겁 먹어도 시원찮았겠지만 형이 만든 음식에 나는 젓가락도 대지 않았다. 몰래 수면제라도 탔을지 알 수 없었다. “이 집에 형이 더 머무를 이유가 없지. 내 집에서 그만 나가줘.” - 호텔마마 5 - 호텔마마 中 내 집 앞에만 오면 사람들은 고약한 냄새가 난다고 토하듯 비명을 질러댔다. 저들은 오만 인상을 쓰는 것은 물론이요, 손을 코앞에 대고 무례한부채질을 해 댔다. 저들에게 역한 냄새를 조금이라도 날려 보겠다는 심사였다. 그러나 내게는 아무런 냄새도 나지 않는다. 도대체 무슨 냄새가 난다고저리들 호들갑인지. 듣고 있는 나로서는 여간 억울한 일이 아니다. 게다가 무슨 탐정 놀이라도 하는 양 저들이 냄새의 정체를 밝혀내고야 말겠다며 현관에 바짝 코를 들이대고 킁킁거릴 때면 내 인내심도 바닥을 긴다. 이해심이라고는 눈곱만치도 없는 저들. 나는 현관문을 퍼뜩 열고 나가 그들의 뒤통수를 한 대 멋지게 갈겨 주고 싶다는 생각을 한다. - 호텔마마 10 - 현관 앞 방문객 中"
제2대항해시대,금영환 저,"태평양전쟁 때 일본이 만든 차원이동 게이트를 발견한 대한민국은 이 게이트를 통해 발견된 새로운 세계를 '신시'라고 명하고 이 곳을 개척함으로 인해 현세에서 새로운 도약을 이루려 치밀한 계획을 세운다. 하지만 이 계획의 일부가 미국에게 알려지면서 할 수 없이 미국의 도움을 받아 신세계를 개척하던 대한민국은 뜻하지 않은 복병을 만나 게 되는데, 그들은 바로 태평양전쟁 당시 패전을 눈 앞에 두고 이 게이트를 통해 신세계로 빠져나간 일본제국의 후손들이었다. 대한민국은 신세계를 차지하기 위해 신일본제국의 후손들과 치열한 전쟁을 치르게 되는데.."
정수영이 읽는 최정희의 흉가,최정희 저,"[100인의 배우, 우리 문학을 읽다] 오디오북 시리즈는, 최민식 문소리 정진영 강부자 등 우리 시대를 대표하는 배우 103명이 한국 근현대문학의 주요 중단편소설 100편을 낭독한 프로젝트입니다. ≪흉가≫는 1937년 ≪조광≫에 발표된 최정희의 단편소설이다. 신문사 여기자인 주인공이 가난한 가장으로서 겪는 공포와 압박감을 섬세하게 표현했다. 당시 ≪조선일보≫ 기자였던 작가는 사실상 자신의 등단작이라고 밝혔다."
